{
  "$schema": "https://json-schema.org/draft/2020-12/schema",
  "title": "Windgram observation document",
  "type": "object",
  "properties": {
    "schemaVersion": {
      "type": "number",
      "const": 1
    },
    "model": {
      "type": "string",
      "pattern": "^[a-z0-9]+(?:-[a-z0-9]+)*$",
      "description": "Lowercase hyphenated slug — the identity of models and sites everywhere."
    },
    "observed": {
      "type": "object",
      "properties": {
        "firstObservedAt": {
          "type": "string",
          "format": "date-time",
          "pattern": "^(?:(?:\\d\\d[2468][048]|\\d\\d[13579][26]|\\d\\d0[48]|[02468][048]00|[13579][26]00)-02-29|\\d{4}-(?:(?:0[13578]|1[02])-(?:0[1-9]|[12]\\d|3[01])|(?:0[469]|11)-(?:0[1-9]|[12]\\d|30)|(?:02)-(?:0[1-9]|1\\d|2[0-8])))T(?:(?:[01]\\d|2[0-3]):[0-5]\\d(?::[0-5]\\d(?:\\.\\d+)?)?(?:Z))$",
          "description": "UTC instant, ISO 8601 with a Z suffix; fractional seconds tolerated."
        },
        "lastObservedAt": {
          "type": "string",
          "format": "date-time",
          "pattern": "^(?:(?:\\d\\d[2468][048]|\\d\\d[13579][26]|\\d\\d0[48]|[02468][048]00|[13579][26]00)-02-29|\\d{4}-(?:(?:0[13578]|1[02])-(?:0[1-9]|[12]\\d|3[01])|(?:0[469]|11)-(?:0[1-9]|[12]\\d|30)|(?:02)-(?:0[1-9]|1\\d|2[0-8])))T(?:(?:[01]\\d|2[0-3]):[0-5]\\d(?::[0-5]\\d(?:\\.\\d+)?)?(?:Z))$",
          "description": "UTC instant, ISO 8601 with a Z suffix; fractional seconds tolerated."
        },
        "generatedAt": {
          "type": "string",
          "format": "date-time",
          "pattern": "^(?:(?:\\d\\d[2468][048]|\\d\\d[13579][26]|\\d\\d0[48]|[02468][048]00|[13579][26]00)-02-29|\\d{4}-(?:(?:0[13578]|1[02])-(?:0[1-9]|[12]\\d|3[01])|(?:0[469]|11)-(?:0[1-9]|[12]\\d|30)|(?:02)-(?:0[1-9]|1\\d|2[0-8])))T(?:(?:[01]\\d|2[0-3]):[0-5]\\d(?::[0-5]\\d(?:\\.\\d+)?)?(?:Z))$",
          "description": "When the pipeline generated this document, UTC."
        }
      },
      "required": [
        "firstObservedAt",
        "lastObservedAt",
        "generatedAt"
      ],
      "description": "The observation window and generation instant — the observation kind's replacement for a run block. The window rolls; the provider's own archive is the permanent record."
    },
    "site": {
      "type": "object",
      "properties": {
        "id": {
          "type": "string",
          "pattern": "^[a-z0-9]+(?:-[a-z0-9]+)*$",
          "description": "Lowercase hyphenated slug — the identity of models and sites everywhere."
        },
        "name": {
          "type": "string",
          "minLength": 1
        },
        "latitude": {
          "type": "number"
        },
        "longitude": {
          "type": "number"
        },
        "timeZone": {
          "description": "The site's IANA timezone, echoed from the sites.json catalogue.",
          "type": "string",
          "minLength": 1
        }
      },
      "required": [
        "id",
        "name",
        "latitude",
        "longitude"
      ]
    },
    "observations": {
      "type": "array",
      "items": {
        "type": "object",
        "properties": {
          "observedAt": {
            "type": "string",
            "format": "date-time",
            "pattern": "^(?:(?:\\d\\d[2468][048]|\\d\\d[13579][26]|\\d\\d0[48]|[02468][048]00|[13579][26]00)-02-29|\\d{4}-(?:(?:0[13578]|1[02])-(?:0[1-9]|[12]\\d|3[01])|(?:0[469]|11)-(?:0[1-9]|[12]\\d|30)|(?:02)-(?:0[1-9]|1\\d|2[0-8])))T(?:(?:[01]\\d|2[0-3]):[0-5]\\d(?::[0-5]\\d(?:\\.\\d+)?)?(?:Z))$",
            "description": "Observation instant, UTC — the product's own timestamp, at its native cadence."
          },
          "downwardShortwaveWm2": {
            "type": "number",
            "description": "Measured downward shortwave flux at the surface, W/m² (GOES-R ABI L2 DSR). Daytime product: instants without a good-quality retrieval are absent from the series — \"not measured\", never zero."
          }
        },
        "required": [
          "observedAt",
          "downwardShortwaveWm2"
        ]
      },
      "description": "Chronological measured instants at product cadence. Gaps are real: an absent instant had no good-quality retrieval (night, quality flags, scan gaps)."
    }
  },
  "required": [
    "schemaVersion",
    "model",
    "observed",
    "site",
    "observations"
  ],
  "description": "Per-site satellite observation time series (GOES-18 ABI L2 downward shortwave today), published at <model-slug>/sites/<site-slug>.json — measurements, not forecasts; join to profile or smoke documents by instant."
}
