{"schemaVersion":1,"model":"goes18-dsr","observed":{"firstObservedAt":"2026-08-10T00:40:21Z","lastObservedAt":"2026-08-10T01:00:21Z","generatedAt":"2026-08-10T05:32:10Z"},"site":{"id":"flagpole","name":"Flagpole","latitude":49.507695,"longitude":-117.310423,"timeZone":"America/Vancouver"},"observations":[{"observedAt":"2026-08-10T00:40:21Z","downwardShortwaveWm2":301.1},{"observedAt":"2026-08-10T00:50:21Z","downwardShortwaveWm2":281},{"observedAt":"2026-08-10T01:00:21Z","downwardShortwaveWm2":251.4}]}
