{"schemaVersion":1,"model":"goes18-dsr","observed":{"firstObservedAt":"2026-08-10T00:40:21Z","lastObservedAt":"2026-08-10T01:00:21Z","generatedAt":"2026-08-10T05:32:10Z"},"site":{"id":"erie","name":"Erie","latitude":49.204789,"longitude":-117.406951,"timeZone":"America/Vancouver"},"observations":[{"observedAt":"2026-08-10T00:40:21Z","downwardShortwaveWm2":274.6},{"observedAt":"2026-08-10T00:50:21Z","downwardShortwaveWm2":271.2},{"observedAt":"2026-08-10T01:00:21Z","downwardShortwaveWm2":254.9}]}
